{
  "schema_version":"cycle109-cert-v1",
  "scope":{"kind":"FINITE_INSTANCE","truth_mode":"EXHAUSTIVE_SOURCE","official_source":true},
  "field_ledger":{
    "p":17,"line_modulus":[0,1],"gen_degree":1,"code_degree":1,
    "q_gen":17,"q_code":17,"q_line":17,"q_chal":null,"uses_q_chal":false,
    "security_denominator":"q_line","target_bits":128
  },
  "instance":{"D":[1,4,16,13],"k":2,"sigma":1,"f":[0,0,0,0],"g":[0,0,0,0]},
  "classifications":{},"charts":[],"paid_caps":{},
  "chart_bound":{"C":0,"uniformity_receipt":{"verifier":"builtin","verified":true}}
}
