{
  "schema_version": "cycle109-cert-v1",
  "scope": {
    "kind": "FINITE_INSTANCE",
    "truth_mode": "EXHAUSTIVE_SOURCE",
    "official_source": true,
    "source_commit": "3c7b6be01145dffe8dc887b5b88461c44f0d84f3"
  },
  "field_ledger": {
    "p": 17,
    "line_modulus": [0, 1],
    "gen_degree": 1,
    "code_degree": 1,
    "q_gen": 17,
    "q_code": 17,
    "q_line": 17,
    "q_chal": null,
    "uses_q_chal": false,
    "security_denominator": "q_line",
    "target_bits": 128
  },
  "instance": {
    "D": [1, 4, 16, 13],
    "k": 2,
    "sigma": 1,
    "f": [1, 13, 16, 4],
    "g": [1, 16, 1, 16]
  },
  "denominator": {"intrinsic_t": 1},
  "classifications": {
    "1": {"primary_branch": "BALANCED", "intrinsic_t": 1},
    "4": {"primary_branch": "BALANCED", "intrinsic_t": 1},
    "13": {"primary_branch": "BALANCED", "intrinsic_t": 1},
    "16": {"primary_branch": "BALANCED", "intrinsic_t": 1}
  },
  "charts": [],
  "paid_caps": {},
  "chart_bound": {
    "C": 2,
    "uniformity_receipt": {"verifier": "external:lean", "verified": false}
  }
}
